[
  {
    "id": "politician-001",
    "name": "Madhav Kumar Nepal",
    "position": "Former Prime Minister (2009–2011), Chairman of United Socialist Party",
    "party": "CPN (Unified Socialist)",
    "photo": "https://upload.wikimedia.org/wikipedia/commons/0/08/KP_Yohannan_with_Madvah_Kumar_Nepal_cropped.jpg",
    "estimatedWealth": "N/A",
    "corruptionAllegations": [
      "Approved land acquisition exceeding legal limits for Patanjali Yogpeeth Nepal in Kavrepalanchok.",
      "Allowed resale/swapping of land at inflated prices, reportedly causing a state loss of NPR 185 million.",
      "First former Prime Minister formally charged by Nepal’s CIAA for corruption.",
      "Also previously linked to the Lalita Niwas land-grab investigation involving land brokers and political collusion."
    ],
    "children": [],
    "lastUpdated": "2025-06-05",
    "sources": [
      "https://en.wikipedia.org/wiki/Madhav_Kumar_Nepal",
      "https://www.myrepublica.nagariknetwork.com/news/madhav-nepal-becomes-first-former-pm-to-be-indicted-by-ciaa-for-corruption-69-61.html",
      "https://asianatimes.com/former-pms-under-scrutiny-nepal-land-grab-probe/"
    ]
  },
  {
    "id": "politician-002",
    "name": "Mohan Bahadur Basnet",
    "position": "Former Minister (unspecified portfolio)",
    "party": "Not specified",
    "photo": "https://via.placeholder.com/150x150/DC143C/FFFFFF?text=MBB",
    "estimatedWealth": "N/A",
    "corruptionAllegations": [
      "Charged over the procurement of the Teramox telecom monitoring system—allegedly advanced without proper evaluation.",
      "Accused of causing financial loss of NPR 3.22 billion to the state.",
      "Suspended from Parliament following charges; granted bail (NPR 2.5 million)."
    ],
    "children": [],
    "lastUpdated": "2025-05-06",
    "sources": [
      "https://en.wikipedia.org/wiki/Mohan_Bahadur_Basnet"
    ]
  },
  {
    "id": "politician-003",
    "name": "Dev Kumar Nepali",
    "position": "Former Mayor of Dhorpatan Municipality",
    "party": "CPN–UML (formerly CPN (Maoist Centre))",
    "photo": "https://via.placeholder.com/150x150/DC143C/FFFFFF?text=DKN",
    "estimatedWealth": "N/A",
    "corruptionAllegations": [
      "Founder and chairman of Image Savings and Credit Cooperative; accused of embezzling over NPR 2.25 billion from thousands of depositors.",
      "Issued an international arrest warrant (Interpol Red Notice); arrested in New Delhi and extradited to Nepal in 2024.",
      "Allegedly enjoyed initial political protection, delaying arrest."
    ],
    "children": [],
    "lastUpdated": "2025-04",
    "sources": [
      "https://en.wikipedia.org/wiki/Cooperative_scandal_in_Nepal"
    ]
  }
]